{
  "$ref": "#/definitions/legacy",
  "definitions": {
    "legacy": {
      "type": "object",
      "properties": {
        "title": {
          "type": "string"
        },
        "role": {
          "type": "string"
        },
        "period": {
          "type": "string"
        },
        "story": {
          "type": "string"
        },
        "impact": {
          "type": "string"
        },
        "image": {
          "type": "string"
        },
        "historicalContext": {
          "type": "object",
          "properties": {
            "title": {
              "type": "string"
            },
            "text": {
              "type": "string"
            },
            "link": {
              "type": "string"
            }
          },
          "required": [
            "title",
            "text"
          ],
          "additionalProperties": false
        },
        "links": {
          "type": "array",
          "items": {
            "type": "object",
            "properties": {
              "label": {
                "type": "string"
              },
              "url": {
                "type": "string"
              }
            },
            "required": [
              "label",
              "url"
            ],
            "additionalProperties": false
          }
        },
        "$schema": {
          "type": "string"
        }
      },
      "required": [
        "title",
        "role",
        "story",
        "impact"
      ],
      "additionalProperties": false
    }
  },
  "$schema": "http://json-schema.org/draft-07/schema#"
}