{
    "title": "The Iron Keeper",
    "role": "Factory Worker",
    "period": "1980 - 2015",
    "image": "/src/assets/img/legacy/iron_keeper.png",
    "story": "Manual labor is the quiet pulse of civilization. The factory floor isn't just a place of production; it's a place where the physical reality of the world meets human endurance. My father's years among the iron taught me that progress is built on the shoulders of those who aren't afraid to get their hands dirty.",
    "impact": "A legacy of grit and the profound dignity found in building the physical infrastructure of our world."
}
