{
    "title": "Polakken",
    "role": "Roemarkernes Arbejder",
    "period": "Starten af 1900-tallet",
    "image": "/src/assets/img/legacy/beet_field.png",
    "story": "Lolland-Falsters historie er uløseligt forbundet med 'roepolakkerne'—tusindvis af polske sæsonarbejdere, der migrerede til Danmark for at arbejde i roemarkerne. Blandt dem var min oldemor, der ankom fra Podkarpackie. Hendes rejse er et vidnesbyrd om migrantarbejderens stille vedholdenhed.",
    "impact": "En historisk påmindelse om, at vores fundament er bygget på både jysk jord og modet hos dem, der rejste for at nå den."
}
