{
    "title": "Barndommens Arkitekt",
    "role": "Dagplejemor",
    "period": "1990 - Til nu",
    "image": "/src/assets/img/legacy/nurturer.png",
    "story": "De første år af livet er de mest kritiske, alligevel overses arbejdet med at skabe den indledende omsorg ofte. Som dagplejer var min mor arkitekten bag tidlig sikkerhed og nysgerrighed for utallige liv. Hendes arv er en af grundlæggende empati—forståelsen af, at fremtidens komplekse systemer bygges på fortidens enkle omsorg.",
    "impact": "En arv af tålmodighed og den grundlæggende omsorg, der gør det muligt for andre at trives."
}
