{
    "title": "Jernets Vogter",
    "role": "Fabriksarbejder",
    "period": "1980 - 2015",
    "image": "/src/assets/img/legacy/iron_keeper.png",
    "story": "Det manuelle arbejde er civilisationens stille puls. Fabriksgulvet er ikke blot et sted for produktion; det er der, hvor verdens fysiske realitet møder menneskelig udholdenhed. Min fars år blandt jernet lærte mig, at fremskridt er bygget på skuldrene af dem, der ikke er bange for at få beskidte hænder.",
    "impact": "En arv af viljestyrke og den dybe værdighed, der findes i at bygge vores verdens fysiske fundament."
}
